id,source_type,text,url,created_utc,flair,score,label,suggested_label,annotation_source,reviewed,notes
post_1tb9c23,post,"People keep trying to downplay Loki while ignoring how absurdly hard the narrative is pushing him.

&#x200B;

Oda didn’t just casually hype Loki once, or twice, he has been wanking Loki many times throughout the whole arc since chapter one after Strawhats did get out of Rodo lego room. The story repeatedly stacks portrayal on top of portrayal:

•Gaban talks about Loki like he’s a genuine world-level monster.

•Imu personally acknowledges him as dangerous

•Harald himself admits Loki with the Nidhogg fruit surpasses him.

•Loki literally beats and kills Holy Knight Harald after getting the fruit.

• And he beats Harald so badly that Harald temporarily breaks free mentally.

And this isn’t some random fodder opponent, it is freaking Harald, who was already portrayed relative to human Rocks D. Xebec before even becoming a Holy Knight. Then he receives the Covenant/abyss enhancement from Imu, which thematically and logically is portrayed as an even greater empowerment than Domi Reversi was for Rocks.

So at bare minimum, Holy Knight Harald ≈ Domi Reversi Rocks tier and Loki did beat, dominate that same Holy Knight Harald.

At that point, what exactly do you people think Oda is trying to portray here? ""Oh this is all for show, it means nothing , Loki is still below Harald or Base Rocks"".

Authors do not repeatedly waste chapters, dialogues, reactions, and thematic framing on a character for no reason, come on, wake up, all of that is narrative construction.

The whole point of Loki’s portrayal is that he’s meant to stand at bare minimum among the absolute monsters of the current era, with the normal obvious conclusion he is above them easily. The story is blatantly framing him as being that freakishly strong.

People can argue exact placements all day, but pretending Oda isn’t screaming “this guy is bare minimum top tier and stronger than any Old Gen pirate” through the narrative is just selective reading at this point.",https://reddit.com/r/OnePiecePowerScaling/comments/1tb9c23/people_keep_trying_to_downplay_loki_while/,1778608629,Discussion,127,,,,0,
post_1tbdd7z,post,"If you ask me, this is a far more likely matchup for Bumkainu than Luffy or Sabo

Like Koby's journey began with getting the reality check that not all Marines are heroes, ones like Captain Morgan are morally corrupt and in many ways worse than pirates.

  
What better final fight than the most morally corrupt and psychopathic Marine of all time?

  
Like he is literally dating Bumkainu's daughter dawg.",https://reddit.com/r/OnePiecePowerScaling/comments/1tbdd7z/if_you_ask_me_this_is_a_far_more_likely_matchup/,1778616960,Discussion,8,,,,0,
post_1tbg63c,post,"Take a seat at the table guys. Let's talk about Holy Knight Harald.

This guy has officially destroyed the scaling of the old gen. His scaling is rather inconsistent, because despite being ""equal"" to Rocks, this guy, after OVER 2 DECADES and a whole ass covenant where bro got buffed to oblivion, he STILL doesnt have better feats than DR Xebec.

Now realistically, this doesnt even make sense since:

A) Domi Reversi is just some random move that Imu can just dish out whereas the HK Covenant is like a ritual so it should be a higher buff.

B) Its been over 2 DECADES since Rocks died. There is no way the King of the Giants has done NOTHING in that time frame. He should have atleast surpassed Rocks base form pre-HK Covenant.

The problem with this Harald bum is because his ass is so weak he got packed by Loki. Now guys, dont pretend Loki aint stronger than Harald. Please dont cope. After that win against HK Harald, we could potentially have chains like this:

Shanks =< Mihawk

Mihawk >= Shanks > Loki > HK Harald = DR Xebec < GV Roger + GV Garp.

We have reason to assume that DR Rocks = Prime Roger as Sengoku did say Rocks was his greatest rival. And if we assume that Harald IS stronger than Xebec, which he realistically should be, then: 

Mihawk >= Shanks > Loki > HK Harald > DR Xebec = Prime Roger = Prime Garp = Prime WB 

Also, the Shanks win against Loki imo probably isnt legit. However, we must maintain the Agenda so I will assume Loki got beat in a 1v1.",https://reddit.com/r/OnePiecePowerScaling/comments/1tbg63c/take_a_seat_at_the_table_guys_lets_talk_about/,1778623160,Discussion,15,,,,0,
post_1tblfxg,post,"Sabo trained on panel after Dressrosa. Chapter 803. Have a great day!

Sometimes people tend to scale characters like Crocodile or Sabo or Koby or Zoro based on feats from hundreds of chapters ago. 

Remeber we are nearing chapter 1200!!!

These important end game characters are only getting stronger as we head into the final arc. Maybe even Akainu will get a power up towards the end who knows. 

Many characters train and grow stronger each arc. Keep in mind

😁🫡 o7",https://reddit.com/r/OnePiecePowerScaling/comments/1tblfxg/sabo_trained_on_panel_after_dressrosa_chapter_803/,1778636505,Discussion,9,,,,0,
post_1tbm2y2,post,"Those who love to say that each gen surpasses the previous gen thus mid gen>old gen, does that mean the old gen is stronger than the ancient gen? Rocks>Davy Jones? Roger>Joyboy?

You can't have it both ways",https://reddit.com/r/OnePiecePowerScaling/comments/1tbm2y2/those_who_love_to_say_that_each_gen_surpasses_the/,1778638157,Discussion,22,,,,0,
post_1tboqyp,post,"Hot take: the only reason these 2 have black blades isn’t because of their strength, it’s because they’re tied to Zoro

Literally no one else has a BB except for Zoro’s ancestor and Zoro’s end goal

  
Shanks was Mihawk’s main rival yet he had no black blade 

Imu,Rocks,Roger and Nika have no black blade, why? Because they’re not tied to Zoro

  
Black blades are only ever important to ZORO, they’re not mentioned with respect to anyone else",https://reddit.com/r/OnePiecePowerScaling/comments/1tboqyp/hot_take_the_only_reason_these_2_have_black/,1778645525,Discussion,13,,,,0,
post_1tbp2la,post,Why would this guy say whitebeard’s not a swordsman doesnt he know the kanji in naginata is the same as katana like this sub says? Is he stupid or something?!?,https://reddit.com/r/OnePiecePowerScaling/comments/1tbp2la/why_would_this_guy_say_whitebeards_not_a/,1778646468,Discussion,13,,,,0,
post_1tbpejx,post,"Alright fine fine ill admit it! Knocking away someone means you are 3 tiers stronger than them! Ty Kizaru bros

Oh yeah wait didn't FRANK also knock away Big Mom?

Oh yeah wait didn't Marco.... 😎",https://reddit.com/r/OnePiecePowerScaling/comments/1tbpejx/alright_fine_fine_ill_admit_it_knocking_away/,1778647468,Discussion,36,,,,0,
post_1tbsmpw,post,"No wonder IMU didn't do shit to Garp in the real world after he bitch slapped him. He knew garp would have smoked him if his ass dared to challenge. He hid in the throne room for a reason. To paraphrase a famous saying, Garp is the one who knocks 😤😤😤 😤😤😤💯💯💯💯💯💯💯.

I love how Garp always goes for a head.",https://reddit.com/r/OnePiecePowerScaling/comments/1tbsmpw/no_wonder_imu_didnt_do_shit_to_garp_in_the_real/,1778658005,Analysis,50,,,,0,
post_1tbwwsr,post,"Harald downplay seems to be prevalent on this sub. So what is the LOWEST you can place him

Given his somewhat close scaling to rocks and the fact that he offscreened and managed to put down retired  gaban and young shanks for some time (who were both low top tiers) while monologuing, while considering he lost his leg and was trying to resist imus control, he is AT LEAST above admirals apart from big business ;) and is a low-mid top tier with heavy downplay",https://reddit.com/r/OnePiecePowerScaling/comments/1tbwwsr/harald_downplay_seems_to_be_prevalent_on_this_sub/,1778671970,Discussion,45,,,,0,
post_1tbxbr6,post,"Reminder that Luffy is still weak to cutting/slash attacks. He won't be able to tank attacks like he did against Kaido if the opponent use a sword, like Imu. His fight in the upcoming chapter should show this very clearly. Even Kaido's weak wind blades were making him bleed.",https://reddit.com/r/OnePiecePowerScaling/comments/1tbxbr6/reminder_that_luffy_is_still_weak_to_cuttingslash/,1778673115,Discussion,21,,,,0,
post_1tbxmzc,post,"If you think about it, Imu is basically a Kaido that fights like Shanks

I'm not gonna lie, I'm really appreciating seeing him fighting. He's totally living up to the expectations we had on him, of an untouchable god-monster who seems unbeatable by any means.

And I say that because not only he seems impossible to damage. We see that his omen defense is nearly unbreakable, but also hit with a straight ragnir hit in the face + thorheim, he's just having a small drop of blood in his forehead. He's literally undestructible like Kaido but on a much larger scale AND he also goes for the kill instantly like Shanks!! him using omen and acoc even on small fries shows that he's a goddamn predator that doesn't waste time like the other tanks we saw.

It's crazy that he has stronger haki than Shanks, has stronger durability than Kaido, stronger hax than Luffy and yet he'll instantly destroy you before you can even notice.

https://preview.redd.it/672r1y829w0h1.png?width=526&format=png&auto=webp&s=64cbaf647511fd5a0baef06e5b0fffc5899e241f

He truly is the god of One piece. I am really satisfied of seeing him in action, idk why some people are disappointed",https://reddit.com/r/OnePiecePowerScaling/comments/1tbxmzc/if_you_think_about_it_imu_is_basically_a_kaido/,1778673923,Discussion,15,,,,0,
post_1tby2yv,post,"Kizaru having stronger haki or being stronger than non G5 Luffy, is just fandom extrapolation fan narrative headcanon, not proven canon manga narrative.

The idea that Kizaru objectively has stronger Haki than post-Wano G4 Snakeman Luffy is fully complete fandom extrapolation, not something the manga clearly establishes. You notice that and clearly see the moment you apply the methods to identify when a narrative is being made or something is being actually stated or portrayed.

Nothing in Egghead explicitly says that ""Kizaru’s Haki > Luffy Haki"" or that ""G4 was fully serious or going all out"", ""Luffy was using ACoC"" or that Kizaru physically overwhelmed him through superior Haki.

Admiral tards mainly build that conclusion off one kick that:

\- mostly caused knockback

\- emphasized barrier damage more than direct damage

\- didn’t have the same framing Oda usually gives when showing massive Haki superiority

And that matters because One Piece consistently portrays huge Haki gaps or when someone possesses stronger haki than someone else VERY clearly. Domi Reversi Rocks vs Roger and Garp proved that when Haki gaps are enormous, weaker attacks barely do damage or fail outright. The story makes overwhelming Haki superiority visually and narratively obvious.

But with Kizaru vs G4:

\- Luffy isn’t getting one-shot

\- It isn't stated, alluded or narratively emphasized that Kizaru possesses such strong haki 

\- Kizaru isn’t casually ignoring all of Luffy attacks through overwhelming Haki

\- there’s no “you cannot hurt him” portrayal

\- literally there’s no narrative statement that Luffy’s Haki is inferior

So saying, “Kizaru’s Haki is stronger than Yonko-level Luffy’s” is not something the manga firmly confirms, especially because Conqueror’s coating is repeatedly portrayed as the highest level of combat expression in the series. It would honestly be strange narratively for a non-CoC user to secretly have vastly superior Haki to a Yonko-tier ACoC user without the story heavily emphasizing it. Saying “Kizaru outright stronger than post-Wano G4 Luffy because of one kick” is way more interpretation than objective canon.",https://reddit.com/r/OnePiecePowerScaling/comments/1tby2yv/kizaru_having_stronger_haki_or_being_stronger/,1778675071,Discussion,10,,,,0,
post_1tc12lr,post,"Luffy was getting hurt by Dragon Twister, and yet fat mfs here want me to think he can survive Kagutsuchi Ace by gv Roger let alone Prime Roger

There's a reason why Oda keeps top tier swordsmen away from Luffy.",https://reddit.com/r/OnePiecePowerScaling/comments/1tc12lr/luffy_was_getting_hurt_by_dragon_twister_and_yet/,1778681980,Discussion,17,,,,0,
post_1tc3k6o,post,"Will base Luffy ever move like this again?

When a charachter gets a power up, often all of their previous forms get nerfed.",https://reddit.com/r/OnePiecePowerScaling/comments/1tc3k6o/will_base_luffy_ever_move_like_this_again/,1778687229,Discussion,1272,,,,0,
post_1tc7kyt,post,"If Pirate King is a navigation title and not a strength one, then why is Roger the Pirate King? Shouldn’t it be Gaban? Since he’s Roger’s Navigatior?",https://reddit.com/r/OnePiecePowerScaling/comments/1tc7kyt/if_pirate_king_is_a_navigation_title_and_not_a/,1778695306,Discussion,58,,,,0,
post_1tc8lhr,post,So far nothing has showed us Imu's real power. Imu could very well use one attack to K.O Loki next chapter. Then again i don't think we are getting a full fight before Sommers and Killingham lose and one of them dies as to nerf Imu. Imu has been too casual.,https://reddit.com/r/OnePiecePowerScaling/comments/1tc8lhr/so_far_nothing_has_showed_us_imus_real_power_imu/,1778697358,Discussion,7,,,,0,
post_1tcacln,post,"A reminder that Roger canonically is having the same reaction if Sengoku pulls up. The man sees Garp or Sengoku at sea and its on sight, if its random marine fodder, they just skip out",https://reddit.com/r/OnePiecePowerScaling/comments/1tcacln/a_reminder_that_roger_canonically_is_having_the/,1778700983,Discussion,8,,,,0,
post_1tcc8of,post,"So Imu basically Jellybean diffed Zoro ?

So it was fire that transformed mid flight into bullets carrying the momentum. Imu could just grab a pebble and kill a YC+ with it if he aims for a vital organ.",https://reddit.com/r/OnePiecePowerScaling/comments/1tcc8of/so_imu_basically_jellybean_diffed_zoro/,1778704991,Discussion,40,,,,0,
post_1tcd01w,post,Reminding yall once again. Loki is currently being toyed with by NERFED Imu. Shanks vs Loki is gonna leave a lot yall feeling disappointed and embarrassed.,https://reddit.com/r/OnePiecePowerScaling/comments/1tcd01w/reminding_yall_once_again_loki_is_currently_being/,1778706620,Discussion,8,,,,0,
post_1tcd9av,post,"If you could take One Line/Statement out of the Series what would it be?

Obviously with what happened during God Valley and the Rocks flashback as a whole, Garp's line training to beat Chinjao doesn't really work. Chinjao was powerful, but nowhere near others like Roger, Whitebeard or Rocks.",https://reddit.com/r/OnePiecePowerScaling/comments/1tcd9av/if_you_could_take_one_linestatement_out_of_the/,1778707163,Discussion,22,,,,0,
post_1tcehp4,post,"Which Attack is stronger between Thorheim & Hakai?

Loki blasts them with Thorheim. Kaido and Big Mom shoot Hakai against it. Who comes out on top?",https://reddit.com/r/OnePiecePowerScaling/comments/1tcehp4/which_attack_is_stronger_between_thorheim_hakai/,1778709845,Discussion,65,,,,0,
