id,source_type,text,url,created_utc,flair,score,label,suggested_label,annotation_source,reviewed,notes
comment_orq1xkd,comment,"https://preview.redd.it/8kd4auo0cd7h1.png?width=250&format=png&auto=webp&s=f0424c41edc0eea1a2385ed4461e62f3e8ead7b3

obviously it didn't seriously injure sanji but it did do damage to him. Also this eye thing is part of his arsenal",https://reddit.com/r/OnePiecePowerScaling/comments/1u64pht/hot_take_every_gorosei_is_yc1_level_but_with_regen/orq1xkd/,1781495311,,14,,,,0,
comment_orqamb6,comment,"Shanks is 24 in this image and he lost his arm at 27.

So this version of Shanks and the Shanks that fought Harold would be the versions of Shanks that Mihawk fought.",https://reddit.com/r/OnePiecePowerScaling/comments/1u66d6e/this_version_was_mihawk_stongest_opponent/orqamb6/,1781498796,,9,,,,0,
comment_orqcj2x,comment,Still insane to me how Blackbeard with 0 DF managed to scar this version of Shanks,https://reddit.com/r/OnePiecePowerScaling/comments/1u66d6e/this_version_was_mihawk_stongest_opponent/orqcj2x/,1781499637,,50,,,,0,
comment_orqehke,comment,"Thank you. 

Gear 5 hit harder, but Kizaru used his speed and battlefield to run down Luffy's timer.",https://reddit.com/r/OnePiecePowerScaling/comments/1u674hd/luffy_is_stronger_than_kizaru_overall_but_kizaru/orqehke/,1781500453,,46,,,,0,
comment_orqen5z,comment,"Kaido canonically didn't make him release him. So nobody could, Shanks doesn't have any feats against any youkou, only feats against an admiral and a YC+.

Kizaru was grabbed by a hand without haki.",https://reddit.com/r/OnePiecePowerScaling/comments/1u66qj3/fun_fact_any_top_tier_can_easily_dodge_this/orqen5z/,1781500521,,8,,,,0,
comment_orqenhn,comment,So youre saying that luffy is tronger than kizaru in general but kizaru matchup diffs him specifically? Fine ill take it,https://reddit.com/r/OnePiecePowerScaling/comments/1u674hd/luffy_is_stronger_than_kizaru_overall_but_kizaru/orqenhn/,1781500525,,83,,,,0,
comment_orqeqsl,comment,"They couldn't. Luffy still has the same speed, one of the highest in the verse.

Beyond the reach and advanced busoshoku.",https://reddit.com/r/OnePiecePowerScaling/comments/1u66qj3/fun_fact_any_top_tier_can_easily_dodge_this/orqeqsl/,1781500564,,10,,,,0,
comment_orqf33c,comment,"the difference here is, kizaru wanted luffy to defeat him to prevent him from killing vegapunk but luffy failed to do so even after kizaru fed him, 

also this meme that you probably saw atleast 200 times

https://preview.redd.it/29453cq5sd7h1.png?width=921&format=png&auto=webp&s=e80fa48238c2af6865d48d51e3111a8cf3a3a5d8",https://reddit.com/r/OnePiecePowerScaling/comments/1u674hd/luffy_is_stronger_than_kizaru_overall_but_kizaru/orqf33c/,1781500708,,9,,,,0,
comment_orqgwcx,comment,"I swear people just use the term “stronger” to mean more AP🫩

No bro. To be stronger, the totality of your kit has to be stronger. Luffy can’t do anything to Kizaru outside of gear 5. And even in gear 5 he couldn’t knock out a mentally nerfed Kizaru who was made to hold back even more by Saturn. He is not stronger.",https://reddit.com/r/OnePiecePowerScaling/comments/1u674hd/luffy_is_stronger_than_kizaru_overall_but_kizaru/orqgwcx/,1781501494,,21,,,,0,
comment_orqhhkr,comment,"Rocks would’ve got yopped immediately in the flower room if he wasn’t PK level

Also any old gentard would have to accept this as it took kinda everyone relevant to stop him at god valley",https://reddit.com/r/OnePiecePowerScaling/comments/1u67ftv/iq_test_how_strong_is_rocks/orqhhkr/,1781501755,,9,,,,0,
comment_orqhkb3,comment,"Considering we saw how Kuzan faired against an old Garp, whilst having the numbers advantage, I don't think it's insane to say Prime Garp can and likely would win this fight, though it wouldn't be easy.",https://reddit.com/r/OnePiecePowerScaling/comments/1u634d6/this_is_just_disrespectful_its_obvious_who_would/orqhkb3/,1781501788,,88,,,,0,
comment_orqhvnn,comment,"If I remember it correctly, and I might not. 

Luffy is holding him with his left hand, so he couldn't escape. Kaido then goes into Flaming Bagua to burn Luffy and force him to let go. But in that form he was too big to dodge.",https://reddit.com/r/OnePiecePowerScaling/comments/1u66qj3/fun_fact_any_top_tier_can_easily_dodge_this/orqhvnn/,1781501932,,8,,,,0,
comment_orqlto4,comment,"This isn’t a silly “if” This is literally what happened if you’ve read the story, The real silly “if” is asking why he didn’t do this instead of relying on Kizaru food for energy?",https://reddit.com/r/OnePiecePowerScaling/comments/1u674hd/luffy_is_stronger_than_kizaru_overall_but_kizaru/orqlto4/,1781503762,,8,,,,0,
comment_orqnneo,comment,"Took them 10 days.

So kuzan deserves a 5b bounty equivalent because he fought Akainu years before he himself deserved his bounty...?",https://reddit.com/r/OnePiecePowerScaling/comments/1u634d6/this_is_just_disrespectful_its_obvious_who_would/orqnneo/,1781504636,,10,,,,0,
comment_orqpkb6,comment,"This is the most valid take. Luffy was clearly superior but, until he manages his stamina, Kizaru could take him down playing smart. Kizaru just wouldn't want to try to take Luffy man to man in a flat out brawl.",https://reddit.com/r/OnePiecePowerScaling/comments/1u674hd/luffy_is_stronger_than_kizaru_overall_but_kizaru/orqpkb6/,1781505580,,31,,,,0,
comment_orqq44s,comment,"What part would be sarcasm? If you can read you’d know that Garp is around Rocks’s level. Rocks did lowdiff an admiral.

Only reason Garp and Roger had to 2v1 rocks was because of domi reversi",https://reddit.com/r/OnePiecePowerScaling/comments/1u634d6/this_is_just_disrespectful_its_obvious_who_would/orqq44s/,1781505853,,14,,,,0,
comment_orqqiu5,comment,"Luffy doesn't even need G5 for Sanji, let alone his strongest attack. That bum gets the Bellamy special in base.",https://reddit.com/r/OnePiecePowerScaling/comments/1u66qj3/fun_fact_any_top_tier_can_easily_dodge_this/orqqiu5/,1781506056,,15,,,,0,
comment_orqqui2,comment,"Garp was fighting the whole islands pirates at the same time dealing with kuzan, whilst protecting koby. Shiryu had to sneak attack him in order to win. And Garp was laughing his ass off at the end. And don’t forget he’s 78 years old at the time!!",https://reddit.com/r/OnePiecePowerScaling/comments/1u634d6/this_is_just_disrespectful_its_obvious_who_would/orqqui2/,1781506217,,30,,,,0,
comment_orqrxio,comment,"Yet his strength is recognized and respected by egotistical bastards like Garp, BM, and Sengoku. Mingo who fears Kaido wholeheartedly agree that WB was the uncrowned king. Garp called WB the King of the Seas, BM placed WB higher than Kaido and Shanks, and Sengoku called WB the strongest. 

I think that alone is a good resume.",https://reddit.com/r/OnePiecePowerScaling/comments/1u691n1/whitebeard_became_known_as_the_worlds_strongest/orqrxio/,1781506758,,12,,,,0,
comment_orr012v,comment,The same way Morgan managed to scar Garp I guess . Power of top tiers having paper durability without haki,https://reddit.com/r/OnePiecePowerScaling/comments/1u66d6e/this_version_was_mihawk_stongest_opponent/orr012v/,1781510973,,7,,,,0,
comment_orr40nt,comment,"Mf got pissed off so badly at my post lmao



>His statements boil down to ""fun fight for Roger"" and being a prominent Admiral in old era.



And you're just gonna ignore that?


The mental gymnastics here is stretching what the implication means, when it's clear what oda wants us to think when he wrote that line.

Being a prominent admiral in an era where roger, whitebeard, big mom, kaido, and a bunch of other big name pirates were active isn't something you should just dismiss.


>If Akainu or Aokiji were active back then and in their prime, there's nothing indicating the exact same statements couldn't be made about them. He has only ever been glazed for his ""tactics and battle iq"", never explicitly for individual strength.




1. Where's the proof that roger and whitebeard would totally have acknowledged the admirals?




2. You're “one of those,” it seems. I already elaborated on this in my post. saying sengoku is only a good tactician and nothing more is factually false.



>Standing next to someone doesn't prove relativity or else Zoro would be relative to Luffy. Additional material is irrelevant or else Jozu starts entering top 5 conversations 👍




Never used this as proof that sengoku is relative to garp?

Additional material being irrelevant only disproves a small part of what I said.

Also, what about jozu? Mind elaborating?



>This guy has the shakiest scaling I've ever seen, mfs want us to accept he is Pirate King level based on the most nothing burger headcanons and mental gymnastics, after his entire era has showcased great onscreen feats except this bum. Dogshit feats, potrayal and narrative. Worse leech than Mihawk but atleast Mihawk has a clear combat title and the narrative of being Zoro's combat goal.




Don’t put words in my mouth,guts. I said I believe sengoku is equal to roger. I never said you or anyone else had to believe that, but you do have to have to believe that he’s at least relative to roger.




Mental gymnastics and headcanon would be stretching what roger said. Any normal person would interpret that as roger respecting sengoku and believing he could give him a lot of trouble. The real mental gymnastics and headcanon is people using that quote to say stuff like “oh, lucci was a fun fight for L
luffy” or “roger thinks a low diff fight is a fun fight because I said so,” and so on.





You’re agenda scaling. Your reasoning for sengoku not being strong is because he has no feats and not so important narrative,so you hate him and think he’s weak. That’s agenda scaling.



Also, this isn’t a hot take. 90% of people here agree with you.",https://reddit.com/r/OnePiecePowerScaling/comments/1u69zoc/hot_take_sengoku_doesnt_have_a_single_argument_or/orr40nt/,1781513111,,7,,,,0,
comment_orr4rn9,comment,I would disagree here. People will say ‘match up diff’ is the only reason Luffy lost but that isn’t a fair point. Kizaru is a really fucking bad matchup for 90% of the verse when he actually fights properly and at that point it stops becoming a matchup diff and becomes a skill issue for his opponents.,https://reddit.com/r/OnePiecePowerScaling/comments/1u674hd/luffy_is_stronger_than_kizaru_overall_but_kizaru/orr4rn9/,1781513520,,37,,,,0,
comment_orr7n8x,comment,"Facts. No matter what agenda people may claim, we can't deny that Garp vs Kuzan was NOT a straight up 1v1. Although he told the other pirates they were no match for Garp, Kuzan didn't do what Katakuri did  (specifically requested no interference).",https://reddit.com/r/OnePiecePowerScaling/comments/1u634d6/this_is_just_disrespectful_its_obvious_who_would/orr7n8x/,1781515059,,22,,,,0,
comment_orr9s9f,comment,"She is referring to military power there.

It doesn't refer to Loki as an individual, but to the giants.

It is stated in the novelization of Ace that any battle between youkoi would be doomed to failure, with both fleets and crews destroying each other. 

Something that wouldn't happen with the help of giants.",https://reddit.com/r/OnePiecePowerScaling/comments/1u6bexa/big_mom_is_a_better_scaler_than_half_this_sub/orr9s9f/,1781516184,,73,,,,0,
comment_orrcraf,comment,"If Imu goes up to Usopp and says ""Next time bring Loki or Zoro"", and if Imu's rival Davy Jones goes ""Imu...Joy boy...Zoro, there aren't many left who remember the ocean the way it used to be"" and if Oda says ""He is able to compete with Imu, Davy Jones, Joyboy, and Zoro"" then sure",https://reddit.com/r/OnePiecePowerScaling/comments/1u6blk0/who_wins/orrcraf/,1781517670,,8,,,,0,
comment_orrfbot,comment,Kaido stomps the guy who had to get his conquerors haki reveal in the vivre card.,https://reddit.com/r/OnePiecePowerScaling/comments/1u6blk0/who_wins/orrfbot/,1781518906,,11,,,,0,
comment_orrgc7s,comment,"Yeah, like, is Luffy really that much stronger if Kizaru can find ways to matchup diff more people than Luffy can beat? I think, honestly, it is the opposite, where Luffy can matchup diff specific strong characters like Kaido because he is stupid and Luffy has crazy damage reduction.",https://reddit.com/r/OnePiecePowerScaling/comments/1u674hd/luffy_is_stronger_than_kizaru_overall_but_kizaru/orrgc7s/,1781519385,,14,,,,0,
comment_orrjh6x,comment,"Yup Also remember this is only what big mom thinks, it’s her perspective, she cannot account for the strength of her rivals and their crew",https://reddit.com/r/OnePiecePowerScaling/comments/1u6bexa/big_mom_is_a_better_scaler_than_half_this_sub/orrjh6x/,1781520822,,11,,,,0,
comment_orrsw42,comment,She’s not saying Loki would solo. But together they’d beat all the yonko crews. Which is reasonable,https://reddit.com/r/OnePiecePowerScaling/comments/1u6bexa/big_mom_is_a_better_scaler_than_half_this_sub/orrsw42/,1781524619,,14,,,,0,
comment_ors3qgf,comment,"Well do you think garp could’ve taken all of them at god valley based on the running ? 

Whitebeard never called Garp the king of  the sea either , something Garp did for wb . Everyone has bad showings",https://reddit.com/r/OnePiecePowerScaling/comments/1u6ftd7/primebeard_garp_stats_comparison_vibe_scaling/ors3qgf/,1781528327,,9,,,,0,
comment_ors5gvl,comment,"Sengoku also said garp and Roger fought to protect the celestial dragons, also that they fought a 2v4, he have 0 credibility",https://reddit.com/r/OnePiecePowerScaling/comments/1u6fu2b/god_valley_roger_is_prime_roger_the_difference/ors5gvl/,1781528886,,8,,,,0,
comment_ors73i2,comment,"How can anyone reach the assumption that Luffy is stronger than Kizaru?

He couldn't even defeat a Kizaru that tried to lose, had to fake going down just to save Luffy and then proceeded to continue not being able to be defeated.

We know for a fact that Kizaru >> Egghead Luffy.

And that's not even serious bloodlusted Kizaru.",https://reddit.com/r/OnePiecePowerScaling/comments/1u674hd/luffy_is_stronger_than_kizaru_overall_but_kizaru/ors73i2/,1781529396,,8,,,,0,
comment_ors7f26,comment,Runbeard is just hilarious tho. Even tho the story tells us they just don’t have the time to deal with Garp since everything is going to shit,https://reddit.com/r/OnePiecePowerScaling/comments/1u6ftd7/primebeard_garp_stats_comparison_vibe_scaling/ors7f26/,1781529494,,10,,,,0,
comment_orsbbnv,comment,Facts why do people forget that garp didn’t even show up to fight kuzan initially? he didn’t even know he was there he was busy fighting mainly pizzaro and a few others at first. Kuzan basically third partied an already ongoing fight,https://reddit.com/r/OnePiecePowerScaling/comments/1u634d6/this_is_just_disrespectful_its_obvious_who_would/orsbbnv/,1781530685,,8,,,,0,
comment_orsblp4,comment,"not the same. Doffy was getting ragdolled the entire time of gear4, he simply had enough endurance to survive its duration, which isnt the same as being able to actively fend him off like kizaru did",https://reddit.com/r/OnePiecePowerScaling/comments/1u674hd/luffy_is_stronger_than_kizaru_overall_but_kizaru/orsblp4/,1781530770,,8,,,,0,
comment_orsbvg6,comment,You believe loki's words but you don't believe gaban's words saying shanks stopped Loki? Curious,https://reddit.com/r/OnePiecePowerScaling/comments/1u6gwsk/loki_any_pirate_crew_including_the_yonkos/orsbvg6/,1781530853,,30,,,,0,
comment_orscmyh,comment,"Not to mention in their fight Garp only ever used one named attack against Kuzan that being ""Blue Hole"" where he just threw him, he never actually used a named punch whereas he directly countered one of Kuzans named attacks ""Ice Glove"" with a regular punch and they had a similar outcome.

Then after having a sword plunged through his chest, he proceeded to blitz past Kuzan and punch Pizarro.

Throughout their whole encounter there was never any movements where Kuzan was getting the better of their ""1v1"" with it either being even or Garp getting the advantage.",https://reddit.com/r/OnePiecePowerScaling/comments/1u634d6/this_is_just_disrespectful_its_obvious_who_would/orscmyh/,1781531082,,8,,,,0,
comment_orsczh2,comment,"1. Loki is probably not even telling the truth here to Luffy. I'm sure that his plan was just to get unlocked and leave and kill Luffy if he had any plans of trying to enforce his contract

2. The vast majority of pirate crews are fodder and honestly, Loki can't even speak intelligently about his power in relation to the other pirate crews because he has been chained up for the past 6 years. Luffy went from being a random child to a Yonko in that time. How is Loki supposed to know that he is still stronger than everyone.",https://reddit.com/r/OnePiecePowerScaling/comments/1u6gwsk/loki_any_pirate_crew_including_the_yonkos/orsczh2/,1781531186,,9,,,,0,
comment_orsf27h,comment,"Powerscalers so desperate they be ignoring irl concepts such as “bragging” or “inflated egos”. And who’s to say that Loki expects Luffy to name a Yonko crew, I’m sure he can wipe any non-yonko crew easily w/without the rest of the giants.",https://reddit.com/r/OnePiecePowerScaling/comments/1u6gwsk/loki_any_pirate_crew_including_the_yonkos/orsf27h/,1781531796,,24,,,,0,
comment_orsf7zm,comment,"So because Luffy’s claimed he’d pack Loki up multiple times, I guess we have Luffy > Loki",https://reddit.com/r/OnePiecePowerScaling/comments/1u6gwsk/loki_any_pirate_crew_including_the_yonkos/orsf7zm/,1781531843,,7,,,,0,
comment_orsgoe1,comment,"Well not really , he actually froze himself willingly to protect his friends if you watch it well . He then attacked him and then he couldn’t freeze anything , garp was just playing around",https://reddit.com/r/OnePiecePowerScaling/comments/1u634d6/this_is_just_disrespectful_its_obvious_who_would/orsgoe1/,1781532268,,7,,,,0,
comment_orskc6e,comment,"If he has EVERY stat over Kizaru, then how the hell was he not able to beat him? That makes no sense.",https://reddit.com/r/OnePiecePowerScaling/comments/1u674hd/luffy_is_stronger_than_kizaru_overall_but_kizaru/orskc6e/,1781533321,,7,,,,0,
comment_orsl8ik,comment,"And i just don’t agree with that.

Who is overall stronger: The guy with slightly higher stats, but only able to fight for 5 minutes, or the guy with slightly lower stats, but can fight for days? I’d give it to the guy who can fight for days.

Obviously we don’t know exactly how long Kizaru’s stamina is. But if Akainu and Kuzan can fight for 10 days, then he should have relatively high stamina too.",https://reddit.com/r/OnePiecePowerScaling/comments/1u674hd/luffy_is_stronger_than_kizaru_overall_but_kizaru/orsl8ik/,1781533575,,8,,,,0,
comment_orsoq5d,comment,"Akainu fans:   
Akainu is stronger than all the admirals because FA > Admirals, unless its pre-ts & you said Sengoku > Akainu 

They also live off Cross Guilt bounty whos for the position of Fleet Admiral

Sengoku portrayal > Akainu portrayal  
Akainu only has better feats & thats cause he was the main antagonist of Marine Ford",https://reddit.com/r/OnePiecePowerScaling/comments/1u6hll3/sanity_check_who_is_stronger_the_dude_that_had_to/orsoq5d/,1781534545,,8,,,,0,
comment_orsvoon,comment,"> She is referring to military power there.

> It doesn't refer to Loki as an individual, but to the giants.

Loki is 99.9% of Elbaf total military power 😂",https://reddit.com/r/OnePiecePowerScaling/comments/1u6bexa/big_mom_is_a_better_scaler_than_half_this_sub/orsvoon/,1781536450,,11,,,,0,
comment_orsxytv,comment,"Rayleigh ends up drawing somehow. The whole exchange of Kizaru vs Rayleigh was to show that they're pretty relative, Kizaru being stronger, but his youth giving him the edge.",https://reddit.com/r/OnePiecePowerScaling/comments/1u6jlzr/lets_say_kizaru_uses_his_clones_here_what_happens/orsxytv/,1781537062,,12,,,,0,
comment_ort1u43,comment,"Rayleigh doesn't give him the opportunity as suggested on panel.

I really dislike this trend of pretending characters are stupid and willingly avoid using their tools for no narratively backed reason.

Kizaru was trying to get past Rayleigh and deal with the straw hats. That's the narrative of the encounter. If he didn't use a specific technique it means he couldn't find the right opening to use it in that specific exchange.",https://reddit.com/r/OnePiecePowerScaling/comments/1u6jlzr/lets_say_kizaru_uses_his_clones_here_what_happens/ort1u43/,1781538091,,13,,,,0,
comment_ort2oam,comment,This comment sections cant be for real man. There's literally nothing Rayleigh can do if Kizaru pulled out his clones. Ray is already huffing and puffing just from some sword swings back and forth.,https://reddit.com/r/OnePiecePowerScaling/comments/1u6jlzr/lets_say_kizaru_uses_his_clones_here_what_happens/ort2oam/,1781538311,,16,,,,0,
comment_ortb7pk,comment,"Thats fair tho Roger does put Sengoku and Garp in the same setence.

It doesnt mean theyre equal, but its still pretty good portrayal",https://reddit.com/r/OnePiecePowerScaling/comments/1u6l3gr/question_to_the_sengoku_wankers_is_base_luffy/ortb7pk/,1781540566,,8,,,,0,
comment_ortbsu5,comment,"He creates a sword. He fights with a sword. He has sword skills.

His first attack against the posters in the manga was with a sword. 

If King and Fujitora are swordsmen, then he is too.",https://reddit.com/r/OnePiecePowerScaling/comments/1u6l1e5/fact_1_today_and_forever_imu_does_not_invalidate/ortbsu5/,1781540718,,8,,,,0,
comment_ortchlw,comment,"This is true. 

After Dory and Broggy, the next stronger giant is not even Doflamingo level. Hajrudin is a fraud.",https://reddit.com/r/OnePiecePowerScaling/comments/1u6bexa/big_mom_is_a_better_scaler_than_half_this_sub/ortchlw/,1781540895,,11,,,,0,
comment_ortcli7,comment,"Roger and WB were regularly placed above the yonko in strength.

- Kaido said Roger could conquer the seas and be PK because of the strength of haki.
- BM places WB above Kaido and Shanks
- Roger and WB clashed equally and fought numerous times 
- Garp called WB the King of the Seas
- Sengoku called WB the strongest 
- WB was stated to be able to become PK whenever he wanted and ruled the seas in front of the throne.
- Chinjao's statement literally says Luffy has to overcome the yonko and admirals 
- Shiki, one of the original 4 Emperors with WB and BM, was stated to would have lost a fight to Roger because the latter is the PK. 

There is a clear strength relation when it comes to being PK.",https://reddit.com/r/OnePiecePowerScaling/comments/1u6lccs/theres_no_such_thing_as_pirate_king_tier_youre/ortcli7/,1781540922,,8,,,,0,
comment_ortp46e,comment,"It means Oda didn't think of it yet, Kizaru clones appear years later in a different arc, it's okay to just say he couldn't do it back then and be done with it",https://reddit.com/r/OnePiecePowerScaling/comments/1u6jlzr/lets_say_kizaru_uses_his_clones_here_what_happens/ortp46e/,1781544151,,18,,,,0,
comment_oru6x94,comment,"Big Mom is **NOT** the correct answer for weakest btw.  
She's quite literally the strongest here.

Big Mom  
Akainu  
Luffy  
Kizaru",https://reddit.com/r/OnePiecePowerScaling/comments/1u6p38c/who_do_you_think_is_weakest_character_here/oru6x94/,1781548666,,35,,,,0,
comment_oruepld,comment,"Sanjitards trying to post without mentioning Zoro challenge...impossible.

It's genuinely quite comical at this point, you all are absolutely incapable of staying in your own lane.",https://reddit.com/r/OnePiecePowerScaling/comments/1u6pr8q/prediction_post_elbaf_zorotard_will_claim_sommer/oruepld/,1781550677,,13,,,,0,
comment_orugcyb,comment,">Kizaru was trying to get past Rayleigh and deal with the straw hats. 

Or he didn't need to try that hard. The Straw Hats were being manhandled by a Pacifista and Sentomaru, so Kizaru not trying his hardest would be fine.

It is Kuma showing up (supposedly an ally of Kizaru and, as we now know, someone from Kizaru's own past) and him sending the Straw Hats away that let them get away.


Well, for all the ""trolling"", it is implied that Kizaru's is actually a hard working fellow, so my take is that Kizaru didn't use it because he didnt knew at the time: He learned how to do the clones during the timeskip of TWO YEARS.",https://reddit.com/r/OnePiecePowerScaling/comments/1u6jlzr/lets_say_kizaru_uses_his_clones_here_what_happens/orugcyb/,1781551109,,8,,,,0,
comment_oruhbfs,comment,"**The real answer is the guy who was already out of stamina after two named attacks in Elbaf.** 

**He isn't beating anyone here with just two named attacks.**

Big mom > Akainu > Kizaru>Luffy",https://reddit.com/r/OnePiecePowerScaling/comments/1u6p38c/who_do_you_think_is_weakest_character_here/oruhbfs/,1781551356,,120,,,,0,
comment_oruma73,comment,"You said Zoro 4 times in one post.....

>Just for him to have harder time against Bum of same level.

King>Queen

Lucci>oh yea Sanji didn't fight anyone on egghead.

>Why fight a bum

Do tell, who else is there on elbaf to fight genius?

>I am just saying once again when Zoro have harder time winning this will be cope.

What are we coping about exactly? You seem to have this all twisted up so I'll spell it out super clear for ya...

The Sanji fandom are the only ones lost and confused in this mess. You all continuously bring Zoro up, continuously leech scale, continuously post the non canon non Oda written magazine quote, and continuously come up with imaginary scenarios to attempt to place them side by side since wano when you know damn well that is not the case.

It's kinda fucking sad.",https://reddit.com/r/OnePiecePowerScaling/comments/1u6pr8q/prediction_post_elbaf_zorotard_will_claim_sommer/oruma73/,1781552671,,9,,,,0,
comment_orup3z7,comment,"Akainu can fight for 10 days if he has to, luffy would be lucky to get to 10 minutes. 

Atheist David v Goliath.",https://reddit.com/r/OnePiecePowerScaling/comments/1u6pmqk/akainu_vs_luffy/orup3z7/,1781553418,,8,,,,0,
