id,source_type,text,url,created_utc,flair,score,label,suggested_label,annotation_source,reviewed,notes
post_1susvqn,post,"Blackbeard final villain is brainrot

I really want to just say the Elbaf mural debunked this, but people are dumb, and think the giant demon in the mural is Blackbeard after stealing Imu's power (Why are the gorosei helping him??). But it's never gonna get to that point 

BB needs to find the actual one piece before he can really do something, that's why he's trying so hard to get it in the first place. So Luffy doesn't become king of the pirates? FUCK you

And he absolutely needs the one piece, look at the power gap in the image. Maybe they can do something if Caribou gets them both Pluton and Shirahoshi, but even then I don't think it's possible with how much emphasis is on finding the one piece first.

The only timeline where I see BB getting Imus power is where he tries to beat Luffy for the one piece, loses, doesn't die, comes back during the war, and steals Luffys kill in the last 20 chapters. But then what? Just do Luffy vs Imu but again? So lame

The story would be ass too. ALL the bad shit in OP is cause of Imu and his asshole government, and the strawhats have been fighting against Imu's regime since the beginning. So why's the final boss some dude who wanted to take over the world and not Imu himself? Just a waste of everyone's time",https://reddit.com/r/OnePiecePowerScaling/comments/1susvqn/blackbeard_final_villain_is_brainrot/,1777066260,Discussion,24,,,,0,
post_1sutmzh,post,"Kaido CLEARLY wasnt sandbagging himself the whole time

Yamato couldnt sustain her hybrid form anymore and switched to base so Kaido did the same xD

Anyone with a brain knows that kaido only got serious post G5, was performing better and only lost cuz he knew Luffy was at his limit and choosed on purpose to not dodge Bajarang Gun",https://reddit.com/r/OnePiecePowerScaling/comments/1sutmzh/kaido_clearly_wasnt_sandbagging_himself_the_whole/,1777068075,Discussion,22,,,,0,
post_1sutxzp,post,"Back when kid actually had my respect

It's crazy how much 1079 changed everything about the top tier scaling. I think before that chapter dropped, maybe 1-2% of people said that shanks would neg diff/1 tap kid, and a lot of people were saying that kid would actually win 😭 what a time to be in the community when this chapter dropped",https://reddit.com/r/OnePiecePowerScaling/comments/1sutxzp/back_when_kid_actually_had_my_respect/,1777068799,Discussion,33,,,,0,
post_1suun0x,post,"Ace is a victim of only existing in Pre-Timeskip

Oda clearly did NOT intend for Ace to be perceived as a weakling. He is the son of Roger. He was a commander in Whitebeard's crew. He had the fire logia. The World Government feared his potential.

The only reason people scale him to YC3 is because pre-timeskip scaling holds him back so much. If he were alive today, people would be placing him no lower than YC+

(To be clear, I'm not arguing he should be YC+, I'm just pointing out how nerfed he is by dying so early on)",https://reddit.com/r/OnePiecePowerScaling/comments/1suun0x/ace_is_a_victim_of_only_existing_in_pretimeskip/,1777070515,Analysis,479,,,,0,
post_1suuy28,post,If you think catching someone off guard while using your strongest 2 techniques (shown) and doing minimal damage is somehow an indicator of Loki winning. You have serious reading comprehension deficiency,https://reddit.com/r/OnePiecePowerScaling/comments/1suuy28/if_you_think_catching_someone_off_guard_while/,1777071288,Discussion,12,,,,0,
post_1suwj8g,post,"Why do people GENUINELY believe that Mihawk does not have Conqueror's?

**FACT**: CONQUEROR'S HAKI is a confirmed trait of 99% of the TOP TIERS   
**FACT**: DOMINATION via CONQUEROR'S HAKI is possible when two individuals have an great difference in their willpower/ambition = CONQUEROR'S HAKI output  
**FACT**: MIHAWK fought extreme-diff with SHANKS for years, during the entire time which SHANKS is confirmed to have CONQUEROR'S HAKI

So, if Mihawk didn't have Conqueror's Haki, he would get CoC-diffed by Shanks, and would not be fighting extreme-diff with Shanks. The fact that he didn't literally proves that he has, at minimum, 12-years ago Shanks-level CoC and better than current Zoro-level CoC. 

He also has top-tier Observation Haki, as his epithet is literally ""Hawk-Eyes"" and has been noted to be able to spot ships from large distances. Not only that, but Mihawk literally has the best current Armament Haki in the verse, confirmed (of course, besides Imu).

These two factors combined makes him indisputably a top-tier user of CoC, CoA, and CoO. Likely, he possesses ACoA as well, considering that he is a swordsman and the best use of Conqueror's for him would be to coat his weapon. Wano Zoro is literally the floor for Mihawk's abilities, Zoro isn't going to end up beating Mihawk because he has Haki that Mihawk somehow doesn't.",https://reddit.com/r/OnePiecePowerScaling/comments/1suwj8g/why_do_people_genuinely_believe_that_mihawk_does/,1777075450,Analysis,16,,,,0,
post_1suy3ql,post,"Gaban already confirmed Loki> kaido awhile back

Gaban knows how strong Kaido is and he knows Luffy beat kaido yet he goes on to challenge Luffy over the key to free Loki.

Despite surrendering to Luffy He also even still warns Luffy it’s a bad decision.",https://reddit.com/r/OnePiecePowerScaling/comments/1suy3ql/gaban_already_confirmed_loki_kaido_awhile_back/,1777079774,Discussion,17,,,,0,
post_1sv4rcg,post,"Who would win? Pregnart Luffy or this guy??

Who stronger? Luffy preglint witha. Baby inside him or that guy???",https://reddit.com/r/OnePiecePowerScaling/comments/1sv4rcg/who_would_win_pregnart_luffy_or_this_guy/,1777099738,Discussion,15,,,,0,
post_1sv63gf,post,"Why do people categorically refuse to question what happened between shanks and Loki ?

I just don’t understand how the idea that shanks defeated loki in a 1v1 ( when it’s only an interpretation of what we have been told, never directly stated ) is such an unshakeable idea to some, I understand if you don’t want to ""bet against shanks"" ( though this is entirely incomparable to what happened to kid both scaling and story wise ) but at least you should admit it’s questionable 

Loki is obviously above everything shanks has been portrayed to be until now, most people I’ve seen with a relatively lower scaling of Loki have even claimed he doesn’t scale higher **because** of shanks ""capping out his level"", I just don’t see how it makes sense to place a character lower than what they are directly witnessing solely because of something that *hypothetically* happened.

I just wish everyone would at least agree that shanks being stronger than Loki is all be completely set in stone",https://reddit.com/r/OnePiecePowerScaling/comments/1sv63gf/why_do_people_categorically_refuse_to_question/,1777104313,Discussion,106,,,,0,
post_1sv6caj,post,"Insane how Imu could've killed Loki right here if he wasn't trying to make him submit

One stab was all it took for Loki to release Ragnir and fall on his back. Imagine if Imu went for another strike at his heart.

He's way too powerful",https://reddit.com/r/OnePiecePowerScaling/comments/1sv6caj/insane_how_imu_couldve_killed_loki_right_here_if/,1777105184,Discussion,57,,,,0,
post_1sv75o6,post,"I keep seeing people act like Kaido just stood there to 'tank' Bajrang, he wanted to CHALLENGE it and got OVERPOWERED.

That's a huge difference.   
  
Also there was enough leftover force to KO him even after his strongest attack failed. By definition he did not tank this.",https://reddit.com/r/OnePiecePowerScaling/comments/1sv75o6/i_keep_seeing_people_act_like_kaido_just_stood/,1777108085,Analysis,37,,,,0,
post_1sv9dhr,post,"There's only one real hakiman and he's the strongest marine in history

(In his prime ofc)

\*Equal to Roger 

\*All 3 types of Haki

\*Acoc

\*Nuking islands at 78

\*One shooting Siriyu at 78, retired, after being stabbed, while certain others fail to kill yc14 characters.",https://reddit.com/r/OnePiecePowerScaling/comments/1sv9dhr/theres_only_one_real_hakiman_and_hes_the/,1777115711,Discussion,253,,,,0,
post_1svb4mi,post,"Stop underrating Loki being able to clash with Imu

People love saying “clash peice” to Loki clashing with Imu but that’s not true 

Imu had to buff his strength and size up with omen and then he later added maki to his polegram to clash with a base Loki with until he outsped Loki.",https://reddit.com/r/OnePiecePowerScaling/comments/1svb4mi/stop_underrating_loki_being_able_to_clash_with_imu/,1777120857,Discussion,8,,,,0,
post_1svctxa,post,"This wasn't because of their devil fruits

Read this theory on twitter, but based on what Imu says this chapter, the envy-driven power, corruption and covenant makes the trinity of ""dominion"". Maybe domi reversi works only on characters that inherently desire to conquer others.

  
We know Rocks wanted to be King of the world, that Luffy explicitly doesn't want to conquer anything, that Loki doesn't want to rule Elbaph. 

Think about it, if Imu had fought Nika and Nidhogg users before and already knew DR doesn't work on those fruits, why would he try to do it at all?

  
The line ""it was expected"" after it fails likely refers to both the fruits having chosen the exact type of people that are free from this desire to conquer and dominate.",https://reddit.com/r/OnePiecePowerScaling/comments/1svctxa/this_wasnt_because_of_their_devil_fruits/,1777125226,Discussion,231,,,,0,
post_1svjoh4,post,"So Loki is confirmed to have a better DF, better narrative(previous nidhogg user was Nika rival) better feats and portrayal, yet we have to assume he loses to Kaido because kaido ran a YC gauntlet one after the other? From last chapter it's pretty obvious loki could smoke sanji/zoro and Kidd/Law",https://reddit.com/r/OnePiecePowerScaling/comments/1svjoh4/so_loki_is_confirmed_to_have_a_better_df_better/,1777141271,Discussion,544,,,,0,
post_1svkpyt,post,"Base vs. Base. Full Zoan vs. Full Zoan. Who wins and what diff?

Before we get the hybrid Nidhogg and Kaidophiles' delusions get ripped apart again.",https://reddit.com/r/OnePiecePowerScaling/comments/1svkpyt/base_vs_base_full_zoan_vs_full_zoan_who_wins_and/,1777143660,Discussion,8,,,,0,
post_1svl8zh,post,"Forget about the Nidhogg blast, who else remains conscious or even survives this Ragnir strike while being off-guard? It can't be more than 5 characters but maybe they all just lose on the spot

It gets even better once you remember this is a giant in Elbaph. The distance Imu got sent flying could very well be all of Alabasta or Dressrosa, that was one STRONG hammer, and he was in giant form too so that helped him take less damage I presume. 

  
No blocking or countering to diminish the damage. Just a character going schizo shouting at the sky and Loki suddenly hits them with all his might. 

  
Personally I am only sure that Big Mom would survive, and even then I'm unsure she'd be able to keep battling. I guess if she's still conscious she could heal. But big chance this KOs her, as we've seen that's possible with a concussion.",https://reddit.com/r/OnePiecePowerScaling/comments/1svl8zh/forget_about_the_nidhogg_blast_who_else_remains/,1777144858,Discussion,24,,,,0,
post_1svmoxe,post,"""Loki"" ""Kaido"" ""Loki"" ""Kaido"" - WE GET IT ALREADY FFS

Literally all in the last day. Can we not have a dedicated Kaido vs Loki thread like we had for Shanks vs Mihawk?",https://reddit.com/r/OnePiecePowerScaling/comments/1svmoxe/loki_kaido_loki_kaido_we_get_it_already_ffs/,1777148198,Discussion,41,,,,0,
post_1svn2fl,post,"The Loki wank will get a lot worse before it gets better.

We have seen it many times before.

Oda makes the weak good guys look strong for a little bit, and then the bad guy stops messing around and destroys them.

Kaido is the best example of this. The Scabbards were easily landing hits on Kaido and making him bleed. The Supenovas were landing hits on Kaido and damaging him. Yamato traded blows with Kaido and hurt him.

But we didn’t see Kaido use high effort until Luffy came back to the roof on Momo. And even then Kaido was still holding back. We didn’t see full power Kaido until Luffy used Gear 5.

Oda will let Loki look good in his hybrid form. Most of the next chapter, maybe even all of it will be Hybrid Loki looking strong against Imu. But it won’t last. Imu will get serious and he will stomp Loki.

So let the Lokitards enjoy the next chapter. Because it won’t last long. Loki’s beatdown is coming.",https://reddit.com/r/OnePiecePowerScaling/comments/1svn2fl/the_loki_wank_will_get_a_lot_worse_before_it_gets/,1777149069,Analysis,134,,,,0,
post_1svqiel,post,"If Loki vs Imu ends after Chapter 1181, what difficulty was it overall and in favour of who?",https://reddit.com/r/OnePiecePowerScaling/comments/1svqiel/if_loki_vs_imu_ends_after_chapter_1181_what/,1777157583,Discussion,42,,,,0,
post_1svraw9,post,"How did whitebeard genuinely not die when lava was pumped inside his body?do organs jus not exist in one piece?

I don’t get how no one questions how whitebeard didn’t straight up die from having 2 fist holes in his chest did oda jus forget about organs.people mention he has a heart attack,that legit shouldn’t be the only problem he has.why is his other organs not straight up failing 😭his heart should be nonexistent,his stomach and other organs jus should have shut of after being pumped with lava. Even still why is none his organs just falling out whiles  he moves around from these 2 fat holes.",https://reddit.com/r/OnePiecePowerScaling/comments/1svraw9/how_did_whitebeard_genuinely_not_die_when_lava/,1777159670,Discussion,26,,,,0,
post_1svs32d,post,If hybrid Loki pushes imu to high end mid diff what does shanks push imu to if he beat Loki in a clean 1v1?!,https://reddit.com/r/OnePiecePowerScaling/comments/1svs32d/if_hybrid_loki_pushes_imu_to_high_end_mid_diff/,1777161788,Discussion,14,,,,0,
post_1svwapm,post,"Wonder if the ""Luffy didn't use Acoc"" crowd will pop out again once he fights Imu",https://reddit.com/r/OnePiecePowerScaling/comments/1svwapm/wonder_if_the_luffy_didnt_use_acoc_crowd_will_pop/,1777173965,Discussion,14,,,,0,
post_1svxzd9,post,"Does Imu's nameless kick have higher AP than Divine Departure? Considering it one-shotted a defending Sanji who's dura > Kid's dura

Also isn't this like one of the absolute best feats in the series? Considering we see Sanji still down this chapter.",https://reddit.com/r/OnePiecePowerScaling/comments/1svxzd9/does_imus_nameless_kick_have_higher_ap_than/,1777179180,Discussion,34,,,,0,
post_1svzopk,post,"Aside from powerscaling, why is this dude hurting your butts !!?

why is Loki so hated, like when i read comments i feel like he did something wrong to your favourite agenda, but boy is just farming aura and story relevance each chapter drops, getting stabbed by Imu??!, is that supposed to be a bad take, oldbeard got face melted by Akainu, Aokiji got his leg removed by Akainu but their fight lasted days, Rocks got domi reversied, kisaru who feed luffy got hit so hard by white star gun.... etc 

but suddenly, Imuu, the ruler of the world and joy boy rival, showcasing his ultimate new maki power against Loki is a bad return against him.. 

that's not men act tbh",https://reddit.com/r/OnePiecePowerScaling/comments/1svzopk/aside_from_powerscaling_why_is_this_dude_hurting/,1777184621,Discussion,71,,,,0,
post_1sw0jn6,post,"Once it’s confirmed Shanks couldn’t beat Loki 1v1, where will your placements of each be?

Even if you disagree, consider it a hypothetical",https://reddit.com/r/OnePiecePowerScaling/comments/1sw0jn6/once_its_confirmed_shanks_couldnt_beat_loki_1v1/,1777187447,Discussion,100,,,,0,
post_1sw0noe,post,"Shanks why are you sneaking and jumping Harald, I thought you were an honourable fighter who only fights fair 1v1s, is Imu controlling you too?",https://reddit.com/r/OnePiecePowerScaling/comments/1sw0noe/shanks_why_are_you_sneaking_and_jumping_harald_i/,1777187833,Discussion,36,,,,0,
post_1sw1txi,post,"Once its inevitably confirmed that Loki got his shit rocked by Shanks, how will “they“ react?",https://reddit.com/r/OnePiecePowerScaling/comments/1sw1txi/once_its_inevitably_confirmed_that_loki_got_his/,1777191874,Discussion,26,,,,0,
post_1sw4g7a,post,"Hot Take: The Old Gen shouldn’t be slandered for not being able to do anything against Imu on God Valley(especially Rocks), while people glaze Luffy and Loki

**DISCLAIMER: I’m not slandering Imu or Loki here, Imu is top 1 and I have Loki>Old Gen, just here me out**

  
I feel like Old Gen downplay has gotten way too out of hand here, so I’m making this post, if you seriously hate them that much then just stop reading this lmao

I see a lot of people argue that since Imu is struggling in elbaph while he did really well on god valley, that the old Gen are powercliffed bums(this applies even more so to Rocks)

But CONTEXT MATTERS

In his avatar form while possessing someone, Imu is practically invincible, he literally can’t die, even when Luffy and Loki fought Imunko, Imu took no significant damage at all, the only reason Imu lost is 1 Ragnir’s Ice being impervious to being thawed and 2 THEIR RESISTANCE TO DOMI REVERSI

Notice how Imu does literally nothing after he sees that loki and were immune to DR? He just sat there, doing nothing

Imu expected Luffy and Loki to be immune to DR and guess what? Imu only refers to Luffy and Loki as “ Nika” and “Nidhogg” exclusively, he doesn’t even know who they are, those are their devil fruits too.

Besides Rocks WAS NOT READY, his wife knew it, he knew it. He wanted 2 devil fruits after all, one of them being Loki’s Nidhogg fruit

Why? Well there are many reasons, but one of them was probably their resistance to Domi Reversi

  
The clash against Imu flat out destroyed him, but he was able to regenerate from it, the same would most likely happen to true form Imu too, since he bled from Loki smacking him to the Adam tree 

  
Loki and Luffy have a matchup advantage against Imu, kinda like Luffy and Enel, Luffy beat enel not because he was stonger(he wasn’t) but because of his rubber powers

It’s a hax situation, which is the ONLY thing the Old Gen lack

So I don’t get why the old Gen get slandered for doing nothing to Imu, when Rocks was literally able to hold his own against Imu, UNTIL DOMI REVERSI, HE GOT HAX DIFFED

Domi Reversi was the problem there

Replace the Old Gen with Shanks Mihawk Blackbeard Akainu Dragon and the other mid Gen top tiers and the exact same thing happens to them

The Old gen are NOT BUMS, they just lacked the matchup counters to Imu‘s hax

Luffy and Loki have them, hence they’re doing better",https://reddit.com/r/OnePiecePowerScaling/comments/1sw4g7a/hot_take_the_old_gen_shouldnt_be_slandered_for/,1777201014,Analysis,38,,,,0,
post_1sw4vea,post,"Shanks vs Loki, did Shanks win fairly or not, place your bet

my opinion on the matter: it's a popular belief that Shanks must have jumped him or used underhanded tactics to capture Loki, and i really question sometimes if people even knows anything about Shanks.

Shanks is stated to be the man Luffy vows and aim to become, and i don't believe by any means that Luffy wants to be like someone who used underhanded tactics to capture someone, let alone the fact Loki was the son of one of his closest friends.

for the jumped thing, i know Luffy has fought battles together, so i admit it's in character for Shanks to fight alongside someone if there's need to, but the statements never says ""the red hair pirates"" and only ever mention Shanks alone, the semantic doesn't support the idea that Shanks might have jumped him, and saying he did wouldn't be adding assumptions not supported by the narrative, thus making the interpretation less likely under occams razor.

also in every interaction we saw of Shanks, he always took the threat alone, vs Wb, vs Kaido, vs Akainu, vs Kidd, people love to use the panel that says he doesn't play by the rule, but if you actually translated the panel, it never says that but just says how he's a pirate.

「お前らの目の前にいるのは海賊だぜ: “The one standing right in front of you is a pirate. (credit to Generalousen for this argument).

it also fits narratively, because it's pretty clear Luffy will reach Loki's level by the end of the arc, but his meeting with Shanks which is destined to be only after he reach his level/surpass him since chapter 1, is being set up to be a next path, via Loki himself.

i don't exclude Loki being stronger and Shanks not winning by being stronger, and i will gladly take the L if it's revealed as much, but for now all points to Shanks having defeated him the right way and being stronger.",https://reddit.com/r/OnePiecePowerScaling/comments/1sw4vea/shanks_vs_loki_did_shanks_win_fairly_or_not_place/,1777202350,Discussion,19,,,,0,
post_1sw51xw,post,"Best theory I have come across so far regarding Shanks and Loki

For further context : In Norse mythology, Fenrir is this great beast who once grew so mighty and wild that the gods started to fear him. There were also prophecies of great destruction surrounding him which further increased the god's fear towards him. Only the god of war Tyr could feed him as he was the only one that Fenrir trusted.

  
As such, the gods conspired to chain Fenrir seeing his growing strength and the danger he possessed. Fenrir was too confident on his strength so they challenged him over that very strength. To test his strength, he was to be bound in chains and break them open through physical strength. It was supposed to only be a challenge.

  
Fenrir broke through the first set of chains, then the second set of chains. For the 3rd time, the gods brought magical chains they asked the dwarves to make. When Fenrir grew suspicious, Tyr convinced him there was no trickery involved, as Tyr was the only one Fenrir trusted.

  
Fenrir could not break the magical chains and when the gods didn't release him, he realized he was decieved by Tyr. The however only tricked him to advert the great destruction Fenrir was capable of causing. Fenrir will be released when Ragnarok occurs.

  
\*\*Conclusion\*\*

  
I think the parallels are clear. Loki is a prideful warrior who was apparently rampaging on the seas 6 years ago. Shanks might have been one of the people he trusted. Shanks knew Loki needs to wait before fighting the World government as the time wasn't right yet, he knew that Loki has to wait till the end of Their world arrives(One piece's equivalent of Ragnarok) and the world is destroyed again.

  
So Shanks challenged Loki to test his strength and bound him in seastone chains. Loki could not break the seastone chains because of his devil fruit powers and realized he was decieved. It's why ""both the Figarland brothers have earned Loki's ire"".

  
It could also explain why Shanks actually comes down into the Underworld to converse with Loki(we know for a fact Shanks was next to Loki right before Luffy arrives there and even told Loki about where he was going). Also that transponder snail with which Loki communicates with Mosa is likely given by Shanks. It's clear Shanks doesn't really consider him and enemy.",https://reddit.com/r/OnePiecePowerScaling/comments/1sw51xw/best_theory_i_have_come_across_so_far_regarding/,1777202936,Discussion,45,,,,0,
post_1sw5zue,post,"People who keep using this. WHO ELSE WOULD EVEN WANT TO STOP HIM?? He’s only attacking the WG, Shanks did it for the prophecy.",https://reddit.com/r/OnePiecePowerScaling/comments/1sw5zue/people_who_keep_using_this_who_else_would_even/,1777205796,Discussion,10,,,,0,
post_1sw79o9,post,"Roger lands a Divine Departure on IMU in the same way Loki hit him here, What's the outcome?

Roger is giving it his all",https://reddit.com/r/OnePiecePowerScaling/comments/1sw79o9/roger_lands_a_divine_departure_on_imu_in_the_same/,1777209351,Discussion,10,,,,0,
post_1sw7h7l,post,"This one panel and age reveal of Harald, can help find out at which exact age Rocks was when at God valley.

We know that Colon, son of Gaban is 20 years old in living years as a giant, but in human years he canonically listed as 8 years old.

Loki says that Harald died at 144 years old, so converting it to in human years, Harald died around 50 years old in human years.

By the logic of Oda loving to do parallel between characters who are very connected in narrative, friendship or brotherhood, I say that when Harald died he died with exact same number or close to same number of human years as Xebec.

Meaning at God valley Rocks D Xebec was around in his yearly or late 50 years old. Which would coincid with fact Rocks doesn't look that much different at God valley than how he looked when he first saw Harald 20 years prior to God valley when they met at Mariejoa. Rocks at Mariejoa looks too old for a 16 years old, because you would have to say at Mariejoa Rocks is entering his 20s and not already a 30 years old dude.",https://reddit.com/r/OnePiecePowerScaling/comments/1sw7h7l/this_one_panel_and_age_reveal_of_harald_can_help/,1777209902,Discussion,149,,,,0,
post_1sw9j2r,post,"BLACKBEARD, WHY ARE YOU SCARED OF YC156 BEPO? DIDN'T YOUR FANS SAY YOU WERE TOP 1????",https://reddit.com/r/OnePiecePowerScaling/comments/1sw9j2r/blackbeard_why_are_you_scared_of_yc156_bepo_didnt/,1777214926,Discussion,207,,,,0,
post_1swamsi,post,"I don’t care Imu is tuff.

After all the Gorosei and holyroppo proved to be disappointing, Imu shows up with a tuff ass design and the DEVIL fruit itself. He starts instantly 1v1ing Loki and is holding up extremely well. He’s genuinely living up to expectations and people slander him for like no reason at all",https://reddit.com/r/OnePiecePowerScaling/comments/1swamsi/i_dont_care_imu_is_tuff/,1777217466,Discussion,276,,,,0,
