id,source_type,text,url,created_utc,flair,score,label,suggested_label,annotation_source,reviewed,notes
post_1tp26zw,post,"Am I the only one who thinks wb has become somewhat underrated ?

Like I get that people have different views , but from speaking on the sub I generally can’t fathom how people have him a tier below roger / garp . 

Whitebeards narrative is on the same tier as roger. They both fought many times and wb was one of the few that pushed Roger to a draw . 

He was also the pirate king in technicality after Roger died . Since he was the one that rivaled Roger on the pirate side , even characters like garp said he was the king of the sea , buggy says he was the man closest to the one piece , the era was literally called whitebeard , shiki says it’s whitebeards era now , not to mention the 5 billion bounty 

https://i.imgur.com/52cbk4H.jpg

Official chapter name 

https://i.redd.it/stop-slandering-shiki-this-man-is-top-3-only-rivaled-by-v0-fb5tcj5enl791.png?width=563&format=png&auto=webp&s=c3dd0e9b9261477031d75ad89b29d5692629fc94

Shiki says its whitebeard era after Roger died 

https://i.redd.it/44ahmfe2xgib1.jpg

Closest to the one piece 

https://i.redd.it/xp1y6u4yzzk91.jpg

Sat before the throne never upon it . This being solely due to his disinterest in the one piece 

5 billion bounty 

https://i.pinimg.com/736x/1d/cf/7e/1dcf7e333727e146269b71884728ae67.jpg",https://reddit.com/r/OnePiecePowerScaling/comments/1tp26zw/am_i_the_only_one_who_thinks_wb_has_become/,1779879731,Discussion,18,,,,0,
post_1tp6blx,post,"Why does Big mom say ""even Whitebeard""? This subreddit told me Shanks is 3 tiers above Prime WB and can low diff his entire fleet

Keep in mind, Big mom has a meticulous intelligence network in-universe and knew about Loki before he was captured.",https://reddit.com/r/OnePiecePowerScaling/comments/1tp6blx/why_does_big_mom_say_even_whitebeard_this/,1779890138,Discussion,341,,,,0,
post_1tp7o5w,post,"Elbaph strength ranking

It's original Gunko in 8th BTW

I don't think this should be controversial unless Zorotard and Luffytards yap sessions",https://reddit.com/r/OnePiecePowerScaling/comments/1tp7o5w/elbaph_strength_ranking/,1779893002,Discussion,23,,,,0,
post_1tparbe,post,"Reminder that a fresh Base Kaido fought a Big Mom that almost drowned, had Amnesia, fought in Udon, got knocked out and then fought without Homies and Amps. Base Kaido = Full Power BM is a Myth.",https://reddit.com/r/OnePiecePowerScaling/comments/1tparbe/reminder_that_a_fresh_base_kaido_fought_a_big_mom/,1779899440,Analysis,19,,,,0,
post_1tpbw60,post,"Current shanks vs gear 5 Luffy ( assuming Luffy can use gear 5 as freely as gear 4 and not just for 5 minutes) does Luffy need better haki to win or can he do it?

(yes the artworks are mine indeed)",https://reddit.com/r/OnePiecePowerScaling/comments/1tpbw60/current_shanks_vs_gear_5_luffy_assuming_luffy_can/,1779901784,Discussion,13,,,,0,
post_1tpcj8j,post,"Can anyone in the old gen keep up with the sun god, god of war, redline serpent, or imu himself on their own?

damn loki is portrayed to be a fkn god😂😂 watch subhuman iqlets say hes below old gen",https://reddit.com/r/OnePiecePowerScaling/comments/1tpcj8j/can_anyone_in_the_old_gen_keep_up_with_the_sun/,1779903107,Discussion,8,,,,0,
post_1tpes0t,post,Canonical first meeting of 15 yr old shanks and 19 yr old mihawk at roger’s execution,https://reddit.com/r/OnePiecePowerScaling/comments/1tpes0t/canonical_first_meeting_of_15_yr_old_shanks_and/,1779907680,Discussion,676,,,,0,
post_1tpfqvl,post,"World's Strongest Life-Form > World's Strongest Creature > World's Strongest Man > World's Strongest Swordsman...stop titlescaling

This is why titlescaling is so shit and ignores all narrative

S-hawk was seen as an appropriate replacement for Mihawk btw",https://reddit.com/r/OnePiecePowerScaling/comments/1tpfqvl/worlds_strongest_lifeform_worlds_strongest/,1779909703,Discussion,9,,,,0,
post_1tpl6c3,post,"There needs to be more Akainu slander

Most offensive logia fruit doesn't instakill with headshots. Stalemates 10 days against a fruit not even stated to be near equal to it. Unable to put down an extremely injured Kuma. Unable to kill Luffy or Jinbei immediately.. 

Idk bro.. Y'all gave Imu, Gorosei, Sabo, Loki, Sanji and Zoro flak for much less 😂",https://reddit.com/r/OnePiecePowerScaling/comments/1tpl6c3/there_needs_to_be_more_akainu_slander/,1779921736,Discussion,11,,,,0,
post_1tplahb,post,"Crazy how overlooked this offer is

People read this and completely ignored that Loki essentially offered to solo wipe any crew, including Yonko.. 

And judging by what we're seeing now, he clearly wasn't exaggerating. 

This should've tipped people off much earlier how strong this guy really is.",https://reddit.com/r/OnePiecePowerScaling/comments/1tplahb/crazy_how_overlooked_this_offer_is/,1779922011,Discussion,1158,,,,0,
post_1tpmatg,post,"Is Imus Nightclub Funded By The Taxpayers' Money?

**Wild intro. I know, but you are here.**

**Firstly**, Akainu’s biggest feat is still killing Ace, but Ace was already completely exhausted, emotionally unstable, and physically worn down after Marineford, and he sacrificed himself to save Luffy, so it’s not really a clean win.

**Secondly**, beyond that, he never fully handled Jinbe, couldn’t stop Luffy from escaping Marineford despite several chances, and against Whitebeard, he also got overpowered by someone who was old, sick, injured, and already near death. He could even use his COC.

**Thirdly**, since the timeskip, he hasn’t really had any major on screen accomplishments that match his reputation. A lot of it gets explained with offscreen or “plot” arguments, but that only goes so far. Not too much to be glazed to that extent. It's not all about feat, but at least show us something other than your dancing moves.

**His not ready for Imus Nightclub.**",https://reddit.com/r/OnePiecePowerScaling/comments/1tpmatg/is_imus_nightclub_funded_by_the_taxpayers_money/,1779924515,Discussion,27,,,,0,
post_1tpqifm,post,"We are at a point where Lokitards think it's ragebait to say Loki can't solo a yonko crew

lmao, will Lokitards every stop the cope?",https://reddit.com/r/OnePiecePowerScaling/comments/1tpqifm/we_are_at_a_point_where_lokitards_think_its/,1779935488,Discussion,12,,,,0,
post_1tpser4,post,"If you asked Oda who would win, Old Worlds Strongest Man Whitebeard or Shanks/Kaido/Big Mom, I think he would say Whitebeard",https://reddit.com/r/OnePiecePowerScaling/comments/1tpser4/if_you_asked_oda_who_would_win_old_worlds/,1779940778,Discussion,36,,,,0,
post_1tpzgql,post,"This image is in Volume 114

Pictures base Rocks (not DR) and claims him as Roger's ‘the first and strongest enemy’!?

Thoughts?",https://reddit.com/r/OnePiecePowerScaling/comments/1tpzgql/this_image_is_in_volume_114/,1779963688,Discussion,101,,,,0,
post_1tpzhgi,post,"Shakky with Boa's DF neg diffs any version of Roger

Even the Pirate King cant stand against her",https://reddit.com/r/OnePiecePowerScaling/comments/1tpzhgi/shakky_with_boas_df_neg_diffs_any_version_of_roger/,1779963755,Discussion,15,,,,0,
post_1tq0gg9,post,"If Zoro is on guard and Shanks can't one shot him, what diff Zoro pushes Shanks?",https://reddit.com/r/OnePiecePowerScaling/comments/1tq0gg9/if_zoro_is_on_guard_and_shanks_cant_one_shot_him/,1779966723,Poll,7,,,,0,
post_1tq0wjx,post,"Crazy how the prime rocks pirates speak of Roger’s greatness . Prime Roger > rocks ?

The 4 strongest rocks members all speak of Roger like he was the goat himself . He is the cornerstone for the old generations scaling fully , even primebeard gets his clout from roger being the main man and fighting wb . 

Big mom upon her death thinks of Roger 

Shiki goes to marineford facing off against 2 goats on the navy side just to bring Roger out . He can’t fathom that the marines including prime garp captured Roger 

Kaido mentions that Roger conquered the world with haki alone , despite not having a devil fruit . 

Whitebeard the wsm and literal rival of Roger thinks of Roger upon his death . 

All this shows a greater respect and awe for Roger than they had for rocks . Which should also infer that prime Roger is above base rocks from god valley",https://reddit.com/r/OnePiecePowerScaling/comments/1tq0wjx/crazy_how_the_prime_rocks_pirates_speak_of_rogers/,1779967982,Discussion,8,,,,0,
post_1tq1i8a,post,"Rocks tries to clash with prime Chinjao's Continent Splitter Head

God Valley Rocks (base- no Imu handouts). Can he overpower the Don?",https://reddit.com/r/OnePiecePowerScaling/comments/1tq1i8a/rocks_tries_to_clash_with_prime_chinjaos/,1779969656,Discussion,12,,,,0,
post_1tq4klb,post,"Why does Oda immediately think about Kaido when he hears the word ""strong""?

Star Fairy never even mentioned Kaido, what did Oda mean by this?",https://reddit.com/r/OnePiecePowerScaling/comments/1tq4klb/why_does_oda_immediately_think_about_kaido_when/,1779976953,Discussion,34,,,,0,
post_1tq9ieo,post,"One piece is not moon level or above and whitebeard cannot blow up a planet. Further characters are not mftl.

Came across many stating this, so felt like I needed to bring this up.",https://reddit.com/r/OnePiecePowerScaling/comments/1tq9ieo/one_piece_is_not_moon_level_or_above_and/,1779987674,Discussion,19,,,,0,
post_1tqgfdo,post,Zoro fans will nag about Sanji's haki growth like their goat didn't receive a sentient relic as a weapon,https://reddit.com/r/OnePiecePowerScaling/comments/1tqgfdo/zoro_fans_will_nag_about_sanjis_haki_growth_like/,1780002217,Discussion,9,,,,0,
post_1tqhvk0,post,Does mihawk refuse to duel with shanks anymore because he considers shanks considerably weaker than him after shanks lost his arm? or is it some swordsman’s code type of thing?,https://reddit.com/r/OnePiecePowerScaling/comments/1tqhvk0/does_mihawk_refuse_to_duel_with_shanks_anymore/,1780005414,Discussion,15,,,,0,
post_1tqp23q,post,"If you think Kizaru beat Luffy, you are a GARBAGE powerscaler. You have to headcanon the fight's result if Luffy had infinite stamina. Also Luffy was MNMC and not using haki whereas Kizaru was tryharding and 200% serious so you have to account for that too. Also Luffy won when he grabbed Kizaru.",https://reddit.com/r/OnePiecePowerScaling/comments/1tqp23q/if_you_think_kizaru_beat_luffy_you_are_a_garbage/,1780023752,Discussion,195,,,,0,
post_1tqqwoc,post,Based on what midhawk fans say these jellyfish are mihawk’s brothers and are top 5 of all time. LOOK AT THE EYES!,https://reddit.com/r/OnePiecePowerScaling/comments/1tqqwoc/based_on_what_midhawk_fans_say_these_jellyfish/,1780028966,Discussion,66,,,,0,
post_1tqt3dw,post,What are you doing Loki? don't you know you're supposed to low-mid diff Shanks according to your glazers? who chained you up gng? ✌️,https://reddit.com/r/OnePiecePowerScaling/comments/1tqt3dw/what_are_you_doing_loki_dont_you_know_youre/,1780035704,Discussion,33,,,,0,
post_1tr02rk,post,"When it's Kaido, it's Tanked

It seem like when it's Kaido receiving damage, he ""Tanked"" it. Especially since he doesn't ""Mention that damage ever again"" which I half agree with.

However, when it's Loki taking damage that he never mentions again \*\*\*(and is also completely fine the next page after that damage is inflicted)\*\*\* it's not counted as ""Tanking"" but rather Loki getting \*\*\*""Destroyed""\*\*\*

🤔",https://reddit.com/r/OnePiecePowerScaling/comments/1tr02rk/when_its_kaido_its_tanked/,1780057084,Discussion,44,,,,0,
post_1tr1unn,post,"Elbaf luffy runs the admiral gauntlet how far does he got each round

R1 : no heals, no break

R2 : no heals but he has all his stamina each round

R3 : full heals",https://reddit.com/r/OnePiecePowerScaling/comments/1tr1unn/elbaf_luffy_runs_the_admiral_gauntlet_how_far/,1780061169,Discussion,114,,,,0,
post_1tr25oe,post,"Truth nuke for Loki fans: If Shanks is shown to beat Loki with Ragnir. Then according to Morgans scaling, pre final war Zoro > healthy Loki with Ragnir. Sanji as well btw.",https://reddit.com/r/OnePiecePowerScaling/comments/1tr25oe/truth_nuke_for_loki_fans_if_shanks_is_shown_to/,1780061836,Analysis,9,,,,0,
post_1tr6xms,post,"Friendly reminder that Imu legitimately didn’t care that the second coming of Joyboy was kicking his pet grandpas’ asses on egghead while Vegapunk exposed his browser history yet he got worried that Rocks tried to save his family.

If that’s not good portrayal idk what is",https://reddit.com/r/OnePiecePowerScaling/comments/1tr6xms/friendly_reminder_that_imu_legitimately_didnt/,1780071463,Discussion,8,,,,0,
post_1tr87pt,post,"Loki vs Gorosei /// would it be the same diff?

Currently Imu is mid-diffing Loki/Ragnir.

What would happen if it was the 5 Gorosei*(egghead)* fighting Loki/Ragnir instead..  
Do the numbers help overwhelm or each one being weaker than Imu allow for a more even fight?",https://reddit.com/r/OnePiecePowerScaling/comments/1tr87pt/loki_vs_gorosei_would_it_be_the_same_diff/,1780073922,Discussion,7,,,,0,
post_1tr9k99,post,"Which of these characters will cause the biggest meltdown in this sub when Oda shows that they're actually HIM?

For me, it's a toss-up between Mihawk and Akainu.",https://reddit.com/r/OnePiecePowerScaling/comments/1tr9k99/which_of_these_characters_will_cause_the_biggest/,1780076563,Discussion,59,,,,0,
post_1trezfj,post,"When you are accused to be a Kaido, Shanks, Mihawk, Zoro, Sanji fan because someone can't handle the slander.

You will never see me glaze diabetisbeard or the giant hobo so I never get confused with their fans.",https://reddit.com/r/OnePiecePowerScaling/comments/1trezfj/when_you_are_accused_to_be_a_kaido_shanks_mihawk/,1780087249,Discussion,14,,,,0,
post_1trhux1,post,"Do you think Garp and Sengoku could defeat Shanks at Marineford if they went all out?""",https://reddit.com/r/OnePiecePowerScaling/comments/1trhux1/do_you_think_garp_and_sengoku_could_defeat_shanks/,1780093846,Discussion,18,,,,0,
post_1trk8x4,post,Honestly with the way Oda has Been Glazing elbaf as the strongest nation for Decades and Having Loki as the oden of Elbaf in terms of natural strength I can’t see him weaker than yonko level even despite the fact that shanks “beat” him,https://reddit.com/r/OnePiecePowerScaling/comments/1trk8x4/honestly_with_the_way_oda_has_been_glazing_elbaf/,1780099893,Discussion,10,,,,0,
post_1trmugg,post,"Shanks fans really look at these fodder get completely obliterated and be like ""that's not an overall strength difference bro, that just skill"".",https://reddit.com/r/OnePiecePowerScaling/comments/1trmugg/shanks_fans_really_look_at_these_fodder_get/,1780107070,Discussion,7,,,,0,
post_1trof4q,post,"Why Shanks does not just jump people all the time, according to Eiichiro Oda's One Piece (1997–present)

We've seen Shanks and the Red Hair Pirates act only a few times in the story, and none of those times fit the ""Jump Hair Pirates"" narrative people have constructed to downplay Shanks.

* Chapter 1, the Red Hair Pirates fought the bandits, a group of people. Shanks didn't even act against them; he let Beckman and Roux essentially solo them. Then, when Higuma escaped, Shanks went after the bandit HIMSELF. 
* Chapter 96, Mihawk pulled up alone to the Red Hairs, and Shanks was very clearly ready to go at him alone, asking Mihawk if he had a score to settle with HIM (doesn't Shanks know he already lost to Mihawk?).
* Chapter 434, Shanks left his whole crew back to go meet Whitebeard, and when a clash happened, the Red Hairs knew not to get involved. If we are to believe Shanks and Kaido's ""scuffle"" was similar, Shanks and Kaido probably handled all of their business between each other. 
* Chapter 579, Shanks went ahead of the rest of his crew to engage Akainu instead of bringing Beckman or Roux with him to jump Akainu, letting Beckman handle a whole separate Admiral. Marineford is the only moment we see the whole crew about to engage in a fight, and they were going to face the Marines. 
* Chapter 928, we hear that when the Kidd Pirates fought the Red Hairs, they didn't even get to see Shanks because Beckman alone took Kidd's arm. 
* Chapter 1055, Shanks handled Greenbull on his own, even knocking out his own crew, literally a reverse-jumping. 
* Chaper 1079, the Red Hair Pirates were trying to tell Shanks to sit out AGAIN just so they could whoop ass, and Shanks told them to let him handle it ON HIS OWN. 
* Chapter 1126, we don't know what happened, but Barto's whole crew was there, so it couldn't have been an actual jumping since it was a group vs group battle.

The ONLY time we've seen Shanks jump a stronger opponent was when he and Gaban fought Harald after he got amped by Imu.

The ONLY other fights we immediately know of off-screen, at least that I can remember, are Shanks's fights with Mihawk, Blackbeard, and Loki. I don't think any rational person would ever assume Shanks jumped Mihawk or Blackbeard, and at no point has anyone ever indicated that the Red Hair Pirates as a group were responsible for Loki's capture.

Shanks is not a jumper like that. Be prepared.",https://reddit.com/r/OnePiecePowerScaling/comments/1trof4q/why_shanks_does_not_just_jump_people_all_the_time/,1780111516,Analysis,18,,,,0,
post_1trp89b,post,the best thing about the Sanji agenda being excluded is that it has nothing to lose and everything to gain,https://reddit.com/r/OnePiecePowerScaling/comments/1trp89b/the_best_thing_about_the_sanji_agenda_being/,1780113895,Discussion,20,,,,0,
post_1trqygm,post,"There really are only 5 main agendas that exist, all others are just sub groups of the main 5

1. Old gen agenda - it’s dying now but used to be the most popular by far, it’s mainly just Roger/WB/Garp glaze

2. Yonko/Kaido/Gorosei agenda - mainly Kaido and to a lesser extent Big Mom glaze, the Gorosei are included by extension as the Yonko agenda’s main enemy is the Admiral agenda and the Gorosei are used as a medium to downplay Admirals

3. Mihawk/Admiral agenda - for some reason Mihawk and Admiral glaze is always intertwined, it’s hard to find someone that glazes one and not the other

4. Shanks agenda - some might include it in Yonko but it’s a lot closer to being it’s own category, especially with how Shanks and Kaido glazers end up on opposing ends

5. Loki/Rocks/Harald agenda - this is mainly the Loki agenda as he’s the most relevant but also includes Rocks and Harald as their scaling is directly tied to Loki’s and they’ve been ditched by the old gen tards so they can cope about old gen > Loki",https://reddit.com/r/OnePiecePowerScaling/comments/1trqygm/there_really_are_only_5_main_agendas_that_exist/,1780119168,Discussion,38,,,,0,
post_1truxf7,post,What’s gonna be the new excuse If Bloodlusted Imu doesn’t apparently neg diff Loki after the flashback ends and Loki still hasn’t entered hybrid yet.,https://reddit.com/r/OnePiecePowerScaling/comments/1truxf7/whats_gonna_be_the_new_excuse_if_bloodlusted_imu/,1780132407,Discussion,10,,,,0,
post_1trwmzf,post,Am I the only one who rates donut boy very high? I think donut boy still is the strongest yc except for benn beckmann amongst the Runkos Past & Present. I don't think citizen of hell or commoners leg have surpassed him yet.,https://reddit.com/r/OnePiecePowerScaling/comments/1trwmzf/am_i_the_only_one_who_rates_donut_boy_very_high_i/,1780138202,Analysis,7,,,,0,
post_1trx54i,post,"What moments genuinely changed your agenda?

Personally, I always thought Roger was stronger than Garp, even though they were always claimed as equals, due to Roger never being captured. God Valley showed me that Roger and Garp are truly equal.

 What about you guys?",https://reddit.com/r/OnePiecePowerScaling/comments/1trx54i/what_moments_genuinely_changed_your_agenda/,1780139753,Discussion,21,,,,0,
post_1tryl54,post,"The Ace v Whitebeard fight in the manga adaption of the Ace side-story is so damn kino

""Even a ten-year old child knows.... that Whitebeard the pirate... was more ferasome than any demon""",https://reddit.com/r/OnePiecePowerScaling/comments/1tryl54/the_ace_v_whitebeard_fight_in_the_manga_adaption/,1780143983,Discussion,409,,,,0,
post_1trzshd,post,"Kaido runs the admiral gauntlet

R1 : full heals, no break

R2 : full heals, break after each round

How far does his ceiling reach

Note: he's serious full powered and doesn't play the same tank game he played with new gen.",https://reddit.com/r/OnePiecePowerScaling/comments/1trzshd/kaido_runs_the_admiral_gauntlet/,1780147177,Discussion,31,,,,0,
post_1ts0bci,post,"Hot take but willing to fight for it.

It’s so funny to me that God Valley Kaido who just got his devil fruit was able to endure an attack from Domi Reversai Rocks.  I’m surprise it not discuss about more often because not just Lucci but numerous other characters would of been back up unlike GV Garling.",https://reddit.com/r/OnePiecePowerScaling/comments/1ts0bci/hot_take_but_willing_to_fight_for_it/,1780148495,Discussion,17,,,,0,
post_1ts127l,post,"After watching this video, I've come to an conclusion that Kaido is the strongest in the One Piece verse.

Only character he went extreme diff with is Primebeard (which is accurate).",https://reddit.com/r/OnePiecePowerScaling/comments/1ts127l/after_watching_this_video_ive_come_to_an/,1780150350,Discussion,7,,,,0,
post_1ts1q1g,post,"Who gave Whitebeard his scar Garling or Shamrock?

In the Oden flashbacks, Whitebeard doesn’t have the scar yet, so we know it didn’t happen during God Valley.

Is it possible Garling got stronger later in life and eventually fought Whitebeard and managed to land it Or maybe Shamrock is involved somehow

But Shamrock would’ve been around 14 15 at most when Whitebeard got the scar, which feels insane to think about. Whitebeard didn’t have it during Oden’s flashback, but he also already had it when he meets Roger later on.

So the timeline is really tight here.

Either:

Garling did something later

Shamrock is way more of a monster than we think

Or is the simplest answer just an Oda blunder and a dropped plotline

What do you guys think",https://reddit.com/r/OnePiecePowerScaling/comments/1ts1q1g/who_gave_whitebeard_his_scar_garling_or_shamrock/,1780151949,Discussion,38,,,,0,
post_1ts3arm,post,"Big mom runs the admiral gauntlet

R1: heals each round, wholecake island bm

R2: heals each round, wano bm

R3: heals each round, prime bm",https://reddit.com/r/OnePiecePowerScaling/comments/1ts3arm/big_mom_runs_the_admiral_gauntlet/,1780155705,Discussion,7,,,,0,
post_1ts6796,post,A reminder for Lokitards that it's just a matter of time until Oda solidifies him as inferior to Luffy.,https://reddit.com/r/OnePiecePowerScaling/comments/1ts6796/a_reminder_for_lokitards_that_its_just_a_matter/,1780162558,Discussion,11,,,,0,
post_1ts73np,post,"Zoro and Sanji fans arguing that Imu didn't one-shot them because they still had an eye open while being unable to move on the ground is genuinely pathetic.

You lost. If you can't move on the ground then it means you died once. You only are alive because the enemy showed mercy or couldn't be bother to end you.",https://reddit.com/r/OnePiecePowerScaling/comments/1ts73np/zoro_and_sanji_fans_arguing_that_imu_didnt/,1780164687,Discussion,20,,,,0,
post_1tsayke,post,If Law provided Kidd an opening to land one full power attack on Shanks. Does Shanks gets one shot?,https://reddit.com/r/OnePiecePowerScaling/comments/1tsayke/if_law_provided_kidd_an_opening_to_land_one_full/,1780173821,Poll,7,,,,0,
post_1tscyy0,post,"IQ Check : Was the Voice telling the truth? Since this sub believes Shanks and Mihawk surpassed Roger and were already born.

Keep in mind, every single time the one that the Voice was actually talking about, Luffy, has used the term ""surpass you"" it has always, always been about defeating an enemy in combat.

  
""I will surpass you and become the Pirate King"".

  
Luffy says this to Kaido and BM clearly meaning he will surpass them in strength.

""I want to surpass Katakuri.""



Means he wants to best him in combat.

  
Luffy's primary role has always been to take down the primary combatant from the opposing side. This was made clear in Arlong park itself with the ""I can beat you"" scene and in Enies lobby as well.

  
So yeah Roger isn't just talking about someone that will be born and get a Gaban-level navigator(which is also included in it) but also that someone will be born who will surpass his own combat strength as the Captain that must protect his crew from enemies.",https://reddit.com/r/OnePiecePowerScaling/comments/1tscyy0/iq_check_was_the_voice_telling_the_truth_since/,1780178743,Discussion,11,,,,0,
post_1tsd2qp,post,Shanks and Mihawk fans when it comes to being the biggest ops but only uniting together against the Loki agenda cuz Loki is the only way to get either of them past the almighty old gen agenda,https://reddit.com/r/OnePiecePowerScaling/comments/1tsd2qp/shanks_and_mihawk_fans_when_it_comes_to_being_the/,1780179011,Discussion,11,,,,0,
post_1tshu96,post,"Why did Rocks want the help of the Nidhogg fruit against Imu?

Do you think there's something about the fruit that specifically affects Imu?",https://reddit.com/r/OnePiecePowerScaling/comments/1tshu96/why_did_rocks_want_the_help_of_the_nidhogg_fruit/,1780192065,Discussion,162,,,,0,
post_1tshvhy,post,Do Lokopers genuinely believe he will show better feats than Luffy against Imu? Might have to do a mass block,https://reddit.com/r/OnePiecePowerScaling/comments/1tshvhy/do_lokopers_genuinely_believe_he_will_show_better/,1780192163,Discussion,8,,,,0,
post_1tsij3e,post,"Hot Take: Blackbeard is weak on paper but still solos 99 percent of the verse cuz he got more plot armour

Like Roger should cook Blackbeard on paper but if the fight were to actually happen, I’m betting my house on Blackbeard, plot armour diff",https://reddit.com/r/OnePiecePowerScaling/comments/1tsij3e/hot_take_blackbeard_is_weak_on_paper_but_still/,1780194083,Discussion,10,,,,0,
